{"$schema":"https://json-schema.org/draft/2020-12/schema","title":"AI Usage Lens Quotas v1","type":"object","required":["schemaVersion","capturedAt","source","windows"],"properties":{"schemaVersion":{"const":"token-lens/quotas-v1"},"capturedAt":{"type":"string","format":"date-time"},"source":{"type":"string","minLength":1},"ordinaryUsageAllowed":{"type":["boolean","null"]},"unvaluedBalances":{"type":["object","null"],"description":"Provider balance with unspecified units; never assumed USD."},"windows":{"type":"array","maxItems":1000,"items":{"type":"object","required":["id","label","usedPercent","remainingPercent","windowDurationMinutes","resetsAt"],"properties":{"id":{"type":"string","minLength":1},"label":{"type":"string","minLength":1},"usedPercent":{"type":["number","null"],"minimum":0,"maximum":100},"remainingPercent":{"type":["number","null"],"minimum":0,"maximum":100},"windowDurationMinutes":{"type":["integer","null"],"minimum":0},"resetsAt":{"type":["string","null"],"format":"date-time"},"spendControlReached":{"type":["boolean","null"]},"rateLimitReachedType":{"type":["string","null"]},"note":{"type":"string"}}}}}}
