{"schemaVersion":"token-lens/quotas-v1","capturedAt":"2026-10-12T04:00:00Z","source":"Synthetic demo","windows":[{"id":"weekly-demo","label":"Weekly window","usedPercent":93,"remainingPercent":7,"windowDurationMinutes":10080,"resetsAt":"2026-10-14T00:00:00Z","note":"Not account data"},{"id":"unknown-demo","label":"Additional window","usedPercent":null,"remainingPercent":null,"windowDurationMinutes":null,"resetsAt":null,"note":"Unavailable example"}]}
