{"schemaVersion":"token-lens/quotas-v1","capturedAt":"2026-10-12T04:00:00Z","source":"synthetic-example—not live account data","windows":[{"id":"weekly","label":"Weekly window","usedPercent":93,"remainingPercent":7,"windowDurationMinutes":10080,"resetsAt":"2026-10-14T00:00:00Z","note":"Synthetic fixture"},{"id":"secondary","label":"Secondary window","usedPercent":null,"remainingPercent":null,"windowDurationMinutes":null,"resetsAt":null,"note":"Demonstrates unavailable values"}]}
